{
  "contract_version": "1.0",
  "recommendation_id": "REC-20261001-142428-687",
  "generated_at": "2026-10-01T14:24:28.160Z",
  "source": {
    "fault_signature": {
      "signature_version": "1.0",
      "source_ref": "ALT-20261001-142408-000",
      "anomalous_params": [
        {
          "parameter": "temp",
          "direction": "high",
          "severity": null
        }
      ],
      "regime": {
        "product": "PA",
        "machine": "L1",
        "regime_label": "S1"
      },
      "degraded_metric": "yield_pct"
    },
    "trigger_alert_id": "ALT-20261001-142408-000",
    "campaign_id": null
  },
  "recommendation_status": "playbook_hit",
  "match_scope": "regime",
  "degradation_path": [
    "regime: best 1.0000 (exp_fault_control_recipe_PA|L1|S1_9150a86409f94269)",
    "-> playbook_hit @regime"
  ],
  "playbooks": [
    {
      "experience_id": "exp_fault_control_recipe_PA|L1|S1_9150a86409f94269",
      "action_sequence": [
        {
          "parameter": "temp",
          "to": 88,
          "to_level": null,
          "unit": "degC",
          "step_order": 1,
          "expected_effect": {
            "delta": -3.5483315384615253,
            "ci95": [
              -3.802199020721638,
              -3.2944640562014125
            ]
          }
        }
      ],
      "expected_effect": {
        "delta": -3.5483315384615253,
        "ci95": [
          -3.802199020721638,
          -3.2944640562014125
        ],
        "metric": "yield_pct",
        "direction_established": true
      },
      "evidence_grade": "E2",
      "corroboration_count": 2,
      "refutation_count": 0,
      "provenance_alias": "eng_03",
      "invalidation_conditions": [
        "超出该 regime_key 工况范围的应用未经本经验支持，不得直接外推"
      ],
      "match_score": 1,
      "autonomy_level": null
    },
    {
      "experience_id": "exp_tuning_action_effect_PA|L1|S1_aff312e4d8d9ab9b",
      "action_sequence": [
        {
          "parameter": "temp",
          "to": 88,
          "to_level": null,
          "unit": "degC",
          "step_order": 1,
          "expected_effect": {
            "delta": -3.5483315384615253,
            "ci95": [
              -3.802199020721638,
              -3.2944640562014125
            ]
          }
        }
      ],
      "expected_effect": {
        "delta": -3.5483315384615253,
        "ci95": [
          -3.802199020721638,
          -3.2944640562014125
        ],
        "metric": "yield_pct",
        "direction_established": true
      },
      "evidence_grade": "E1",
      "corroboration_count": 1,
      "refutation_count": 0,
      "provenance_alias": "eng_03",
      "invalidation_conditions": [
        "超出该 regime_key 工况范围的应用未经本经验支持，不得直接外推"
      ],
      "match_score": 1,
      "autonomy_level": null
    }
  ],
  "final_setpoints": null,
  "fallback": null,
  "ack": null,
  "provenance": {
    "script_version": "match_playbook/1.0",
    "authored_by": "script"
  }
}