{
  "contract_version": "1.0",
  "recommendation_id": "REC-20261006-035748-043",
  "generated_at": "2026-10-06T03:57:48.805Z",
  "source": {
    "fault_signature": {
      "signature_version": "1.0",
      "anomalous_params": [
        {
          "parameter": "smoke_probe",
          "direction": "high"
        }
      ],
      "regime": {
        "product": null,
        "machine": null,
        "regime_label": null
      },
      "degraded_metric": null
    },
    "trigger_alert_id": null,
    "campaign_id": null
  },
  "recommendation_status": "fallback_generic",
  "match_scope": null,
  "degradation_path": [
    "regime: 0 candidates",
    "product: 0 candidates",
    "machine: 0 candidates",
    "generic: best 0.0000 (exp_tuning_action_effect_PA|L1|S1_aff312e4d8d9ab9b)",
    "-> fallback_generic (参数重叠不足，回落 doe-analyzer 提示)"
  ],
  "playbooks": [],
  "final_setpoints": null,
  "fallback": {
    "doe_analyzer_hint": "本地经验库无可用命中：建议 (1) 对该工况数据运行 industrial-doe-analyzer 观察模式分析以积累首个窗口经验；或 (2) 由 AWS 侧经 kb_agent 查询知识库宽知识后再决策。"
  },
  "ack": null,
  "provenance": {
    "script_version": "match_playbook/1.0",
    "authored_by": "script"
  }
}